{
  "schema_version": "gematria-glitch.corpus.v1",
  "corpus_id": "cmb.gematria.demo.replication",
  "version": "1.0.0",
  "gematria_system": "mispar_hechrachi",
  "records": [
    {
      "id": "rep-001",
      "word": "נחש",
      "gloss": "serpent",
      "source": {
        "id": "rep-source-001",
        "kind": "declared_demo",
        "reference": "GEMATRIA-GLITCH-1 replication demonstration corpus"
      }
    },
    {
      "id": "rep-002",
      "word": "משיח",
      "gloss": "anointed one",
      "source": {
        "id": "rep-source-002",
        "kind": "declared_demo",
        "reference": "GEMATRIA-GLITCH-1 replication demonstration corpus"
      }
    },
    {
      "id": "rep-003",
      "word": "אמת",
      "gloss": "truth",
      "source": {
        "id": "rep-source-003",
        "kind": "declared_demo",
        "reference": "GEMATRIA-GLITCH-1 replication demonstration corpus"
      }
    },
    {
      "id": "rep-004",
      "word": "לב",
      "gloss": "heart",
      "source": {
        "id": "rep-source-004",
        "kind": "declared_demo",
        "reference": "GEMATRIA-GLITCH-1 replication demonstration corpus"
      }
    },
    {
      "id": "rep-005",
      "word": "חכמה",
      "gloss": "wisdom",
      "source": {
        "id": "rep-source-005",
        "kind": "declared_demo",
        "reference": "GEMATRIA-GLITCH-1 replication demonstration corpus"
      }
    },
    {
      "id": "rep-006",
      "word": "שלום",
      "gloss": "peace",
      "source": {
        "id": "rep-source-006",
        "kind": "declared_demo",
        "reference": "GEMATRIA-GLITCH-1 replication demonstration corpus"
      }
    },
    {
      "id": "rep-007",
      "word": "תורה",
      "gloss": "Torah",
      "source": {
        "id": "rep-source-007",
        "kind": "declared_demo",
        "reference": "GEMATRIA-GLITCH-1 replication demonstration corpus"
      }
    },
    {
      "id": "rep-008",
      "word": "מים",
      "gloss": "water",
      "source": {
        "id": "rep-source-008",
        "kind": "declared_demo",
        "reference": "GEMATRIA-GLITCH-1 replication demonstration corpus"
      }
    },
    {
      "id": "rep-009",
      "word": "אש",
      "gloss": "fire",
      "source": {
        "id": "rep-source-009",
        "kind": "declared_demo",
        "reference": "GEMATRIA-GLITCH-1 replication demonstration corpus"
      }
    },
    {
      "id": "rep-010",
      "word": "רוח",
      "gloss": "spirit or wind",
      "source": {
        "id": "rep-source-010",
        "kind": "declared_demo",
        "reference": "GEMATRIA-GLITCH-1 replication demonstration corpus"
      }
    },
    {
      "id": "rep-011",
      "word": "ספר",
      "gloss": "book",
      "source": {
        "id": "rep-source-011",
        "kind": "declared_demo",
        "reference": "GEMATRIA-GLITCH-1 replication demonstration corpus"
      }
    }
  ]
}
